{
  "event_id": "11111111-1111-4111-8111-111111111111",
  "type": "task.completed.v1",
  "schema_version": 1,
  "tenant_id": "11111111-1111-4111-8111-111111111111",
  "project_id": "11111111-1111-4111-8111-111111111111",
  "aggregate_id": "11111111-1111-4111-8111-111111111111",
  "aggregate_version": 3,
  "authority_epoch": 1,
  "occurred_at": "2026-10-09T04:00:00Z",
  "recorded_at": "2026-10-09T04:00:01Z",
  "producer": "agent-runtime",
  "actor": {
    "principal_id": "11111111-1111-4111-8111-111111111111",
    "kind": "agent"
  },
  "correlation_id": "11111111-1111-4111-8111-111111111111",
  "classification": "confidential",
  "residency": "us",
  "payload_ref": {
    "artifact_id": "11111111-1111-4111-8111-111111111111",
    "digest": "sha256:aaaaaaaaaaaaaaaaaaaaaaaaaaaaaaaaaaaaaaaaaaaaaaaaaaaaaaaaaaaaaaaa"
  },
  "causation_id": "22222222-2222-4222-8222-222222222222"
}
